29,"The rice field</em> is harvested once a <em>month to get food for our stomach.","The stomach is the part of the body that digests food (which, in Japan, is mainly rice).","The stomach is the part of the body (月）that tells my brain (田) when to eat rice.","A field of rice could fill my stomach for over a month.","The astronaut had an empty stomach</em> because you can&#039;t grow rice</strong> <em>on the <strong>moon.","Zombies want my brain in their stomach.","A rice field feeds my STOMACH for a month.","The lower radical that looks like the moon (月) is actually an abbreviation of 肉 (niku, meat) in words that describe body parts. The radical is actually called にくづき. / The rice that you grow on your rice field</em> will end up in this <em>body part, the stomach.","Remember Krang from Teenage Mutant Ninja Turtles and that flesh</em>-colored weird robot that was carrying the evil <em>brain around in its stomach?","What part of the body (月) does rice (田) go to? The stomach."
30,"A nightbreak happens when the sun rises over the horizon (floor).","It may be easier to think of the keyword &quot;DAYBREAK&quot; or &quot;MORNING&quot; for this kanji (other kanji dictionaries do). Then the mnemonic phrase &quot;SUN rising over the HORIZON&quot; works better. It is an infrequent kanji, but can be found in: 旦夕　（たんせき） morning and evening, or 元旦　（がんたん） New Year&#039;s Day.","The sun rising over the horizon is giving the night</strong> a <strong>break</strong>. -<strong>nightbreak.","HINT: You can substitute sunrise in your stories if you don&#039;t like the rare (and ambiguous) &quot;nightbreak&quot;. Note that <a href="/study/kanji/0.000000E+006   0X0P+0"Nightbreaks when the sun</em> peeks over the <em>horizon at dawn.","Since nightbreak</strong> is a word I can never manage to use in a natural sounding sentence, and since this is clearly a picture of the sun coming up over the horizon, I call this one <strong>sunrise</strong>. It&#039;s no more confusing than<strong> nightbreak is with Daybreak 1201 and Dawn 2448, and it&#039;s a lot easier to make stories with.","In Japan, when the sun</em> comes up over the <em>horizon, it&#039;s called NIGHTBREAK (not daybreak).","I change this kanji&#039;s keyword to daybreak so that it actually means in English what it means in Japanese. The reason Heisig didn&#039;t choose daybreak for this kanji is because he already has daybreak chosen for 暁. I just change that one to dawn because they mean basically the same thing, and the image of a sun slowly coming up over the horizon is a clearer image of daybreak to me.","旦那, 元旦, <a href="/study/kanji/0.000000E+006"night breaks as the sun rises over the horizon."
31,"The moon has a lot of gall sticking around after sunrise.","All the month</em> long I have to start working at <em>nightbreak. This really activates my gall bladder (=I get angry).","For a month（月）, I was up until nightbreak（旦） because of my gall bladder（胆）.","The gall bladder digests the flesh (meat) before nightbreak so you are ready to start your new day.","The gall bladder is the part of the body</em> that secretes bile, mostly after <em>night break, to help digest fat eaten during dinner.","If you drink all night long (moon), until the night break your gall bladder will have problems...","You&#039;ve got some gall calling around here every month after night break!","According to the chinese medicine the gall bladder comes to its activity between 23h and 01h, so it is between night (when moon cames) and nightbreak.","Ah, the GALL BLADDER</strong>. Heisig certainly has <strong>gall putting it this early in his book! Wikipedia says it&#039;s the part of the body</em> which stores gall until you need it to digest fatty foods; say, at <em>nightbreak (ah, that fatty full English breakfast!)","To remember gall bladder</strong>&#039;s no difficult matter:/First the kanji for flesh</em> 月, which resembles a ladder;/Then the kanji for <em>sun</em> 日 over kanji for <em>one 一;/Gall has three parts, so<strong> gall bladder is done. 胆石、たんせき, gallstone; 大胆、だいたん, bold, daring: 単独でその崖を登るのは大胆な行為です, &quot;To climb that cliff alone is a daring act.&quot; 彼はそれをする大胆さがなかった, &quot;He did not have the boldness to do it.&quot; 落胆、らくたん, disappointment, discouragement: 彼の大勝利に相手は落胆した, &quot;His opponent was discouraged by his great victory.&quot;"
32,"The sun spans from horizon to horizon in a day.","The span of the day is the time between the sun goes up and comes down.","The sunlight spans from the floor to the ceiling.","A sun span-wich.","The sun spans the heaven and the earth.","Durata</strong> : Pensare al tempo che ci mette il sole ad arrivare dal punto più basso linea dell&#039;orizzonte (Alba) al punto più alto attraversando il cielo, cioè la linea parallela all&#039;orizzonte. <strong>Composizione</strong> : <a href="/study/kanji/0.000000E+004"The Days</em> BETWEEN <em>Two important events - birth and death - mark the SPAN of our lives.","The sun rises, the sun sets. The span of a day.","The sun</em> SPANS the two <em>horizons.","The span of one</em><em> day</em> to <em>one other."
33,"The letter &quot;U&quot; is concavely written.","Concave</strong> has a<strong> concave shape.","Stroke order: I took a step down into the cave. A park ranger threw down a line to me from the opposite top ridge, then waited. My friend went down to the lowest passage to look for me, then the ranger threw another line down to her.","Her CONCAVE 凹 pussy was fucked by my convex 凸 cock.","Concave is like a vagina.","There used to be three buildings but one concaved.","Stoke order: the top of concave</strong> is the strokes of the top of convex</em> in the opposite order, since 1)<strong> concave</strong> is the opposite of <em>convex</em> and 2) that is what makes sense visually. (This assumes that you can visualize<strong> concave and convex, of course). See my notes for <em>convex.","Concave</strong>=Concave. When you put it in a girl&#039;s<strong> concave</strong> and do a good job, she goes OUUUUUUUUU.<strong> Concave is like a vagina.","rude warning - A womens genitalia is concave! This will help remember kanji 34, a mans genitlia is convex! :).","Concave</strong> by name,<strong> concave by nature."
34,"When I get vexed, I give people the middle finger.","Convex</strong> has a<strong> convex shape.","Sex makes me convex.","Men are convex; women are complex.","Stroke order: think of questing forward, then climbing a huge vertical stroke, only to take an easy step down. (Remember the three segments of the step down are one stroke. There is no such equivalent for the step up, so you have to take it segment by segment.) The bottom is just like mouth.","My convex 凸 cock fucked her concave 凹 pussy.","Japanese Idol&#039;s make my pants convex.","A guy giving the middle finger &quot;Convex You!&quot;","Rude Tetris piece.","Vexed over its weird stroke order, CONVEX</strong> gives the middle finger to the rest of the kanji. ---- <strong>On</strong>: トツ <strong>Kun: でこ."
35,"Age 18 = olden times.","The old man with a walking stick kept talking of olden times all day long.","In olden times, gentlemen used walking sticks</em> every <em>day.","In the olden times the sun used a walking stick, cursing and swinging at planets as they whizzed by.","The number 18 on an olden times calculator.","The ON reading of this kanji is きゅう kyuu because the picture is 1+8=9 = 九 「きゅう」 Something that happened on the 18th century is olden times.","A wall</em>-like barrier prevents the <em>sun from going backwards, so he can&#039;t return to olden times.","Men with walking sticks</em> sit around all <em>day talking about OLDEN TIMES.","Olden times?!? That happened one day ago!","The 18 pictured here stands for the olden times</strong> of the 1800s. This will help you remember the order of the primitives, because the year 8100 couldn&#039;t possibly be<strong> olden times."
36,"To use an eyedropper by oneself, aim from above</em> to put a <em>drop</em> into the <em>eye.","I know this, but I am an idiot and forgot.... The way I remember this is to think of the way in which Japanese people point to themselves if they are unsure of who is being spoken to. In the west, we usually say, &quot;me?&quot; and point to ourselves (pointing to the chest), but in Japan, people say, &quot;ore/boku/atashi?&quot; and point directly at their nose, the drop between their eyes. True story.","Faced with his clone, our hero valiantly cut a mark</em> on his forehead right above his <em>eye so that his comrades could tell his true oneself from the enemy.","Eyedrops are applied by ONESELF.","In Japan, one refers to oneself by pointing to their nose: then point between the eyes!","Me, myself and eye.","Eye drops are best applied by oneself.","Oneself would find it difficult to drop</em> something in one&#039;s own <em>eye.","1 on a shelf (oneself).","When Japanese people refer to themselves (oneself), they often point at the drop</em> between their <em>eyes</em>, which is also their <em>nose."
37,"A white ray is a drop of sun.","Even a small drop (&#039;) of the sun (日) would make you see nothing but white.","It&#039;s a nice DAY for a WHITE wedding.","WHITE is a drop of sun.","A drop</em> one <em>day</em> fell from above; it was white and from a <em>dove... gross.","A drop of sun is white.","A DROP of SUNlight will turn your photographs white.","A drop</em> of the <em>sun - a sunray - includes all light of the visible spectrum and thus appears white.","しろ … ① フランスの国旗は青、白</strong>、赤です … こっき、あお、あか … The French <a href="/study/kanji/0.000000E+006"A drop of sunlight will turn your photos white."
38,"100 turned sideways. <a href="/study/kanji/sort+of+the+same+as+what+ashoksaraf+said">sort of the same as what ashoksaraf said</a>.","That dirty ceiling was painted WHITE a hundred times!","The &quot;white year&quot; (99) plus one more. 100!","Hundred is 1 0 0 written from top to bottom. 一 is connected with the two concatenated 口 because the latter would otherwise fall off.","A HUNDRED turned on its side.","Two O hung on one.","ONE DROP of SUN can travel a HUNDRED light years.","People who are a hundred</em> years old have <em>white hair.","100 has been flipped on to its side.","I&#039;ve said it a hundred times, this ceiling will not be painted white."
39,"Pocky goes in the mouth.","My GF lets me come in her mouth (pictogram).","It&#039;s my dick in a box!","&quot;SSsshhh!! we are IN the library&quot;, she said, expressed with a finger over her mouth.","I use chopsticks to put food in my mouth.","In</strong>diana Jones thrust a walking stick</em><strong> in</strong> the crocadile&#039;s <em>mouth just<strong> in time!","A walking stick in</strong> a mouth? That&#039;s<strong> in-possible!","Don&#039;t put that stick</em> in your <em>mouth. You done know where it&#039;s been.","IN the MIDDLE.","Putting a bookmark in-between the pages of a book."
40,"It takes many drops of ten to get to a thousand.","One T = one thousand.","1000 = 10</em>^3 (<em>3 strokes).","The primitives of drop</em> and <em>needles are at work here. One drop from this needle could save thousands of lives!","The number ten bought a fancy hat for a THOUSAND yen!","I heard &quot;DROP and give me TEN&quot; about a THOUSAND times when I joined the army.","Drop ten bucks to get a thousand pennies.","A thousand</strong> <strong>CENTS drops</em> to <em>ten dollars. (ON reading is SEN).","If I DROPped a thousand needles into a haystack, I might be able to find TEN.","One drop</em> from this <em>needle could save a thousand lives!"
41,"What is in a mouth</em> that permits it to speak a <em>thousand things? Yes, a tongue.","A thousand mouths speak the same TONGUE.","Kissing a thousand</em> <em>mouths eventually gets you some tongue.","Thousand mouths, a thousand tongues.","When you drop because you are <a href="/study/kanji/0.000000E+0050.0000000X0P+04">古</a> (<span class="frnr">#16</span>), you stick your tongue out.","The TONGUE</strong> allows the THOUSAND different sounds of English to come out of your MOUTH. (True story - English has 1000+ distinct sounds, while Japanese has about 80. So think of Japanese people struggling to pronounce correctly because they can&#039;t get their<strong> tongues to cooperate.)","There are a thousand</em> tastebuds on your tongue in your <em>mouth.","A tongue allows the mouth to speak thousands of words.","My tongue was in a thousand mouthes.","Kissing a thousand mouths will get you some tongue."
42,"It is a thousand or ten? I need my measuring box.","I can fit a thousand needles into my measuring box, but only if I bend the thousand.","A measuring box is a square wooden box that was used to measure one thousand grains of rice (needles) in feudal Japan. It was supposed to be enough to feed a working man for one day.","Be careful when drinking sake out of a deep measuring box. The hangover can feel like a thousand needles.","Give me a thousand smacks with a walking stick if I forget the Kanji for measuring box again!","Is it 1000</em> (千) or <em>10 (十)? Let me get my measuring box.","It takes to long to count 1000 needles or nails, so a box is used to messure them out. Fill the measuring box and that is roughly 1000.","10-10 -&gt; 1010 -&gt; a <a href="/study/kanji/0.000000E+005"Let me &quot;shou&quot; (show) you how bad I am at &quot;masu&quot; (math) - I need my measuring box to add 1000 and 10. &gt;_&lt; &quot;masu&quot;: ます &quot;shou&quot;: しょう.","This MEASURING BOX has a scale from a Thousand</em> on the LEFT to <em>Ten on the RIGHT."
43,"This kanji does not mean &quot;get up&quot; or &quot;awake.&quot; It means rising, like the rising of a salary, or a promotion. STORY: You know that your salary has RISEN UP when your MEASURING BOX has enough dollar bills in it to reach the SUN.","We Measure the Sun to decide when we should Rise Up out of bed.","If the sun</em> sat on the <em>measuring box made of a thousand needles he would rise up very quickly.","In old Japan the villagers used to put their measuring box on an east facing window ledge so that the sun would rise up above it and hence would be the first thing they saw in the morning. This was to remind them to use the box to measure out their kome for asagohan and ensure their store of rice would last the whole week.","&quot;When sun RISE UP, get sake cup.&quot;","The only way to rise up at your job in Japan is to drink sake from measuring boxes</em> every <em>day with your coworkers.","This is a pictograpgh of a couple, holding hands and watching the sun RISE UP. The girl is the one on the left with the long hair who&#039;s sitting with her legs to the site and reaching to kiss her husband on the right who she&#039;s holding hands with.","A thousand and ten naked people held hands underneath the blazing hot sun. That would cause most guys to rise up. *vividness is key.","This is a pictogram of a sun</em> over a Thermometre (<em>measuring cup</em>). The heat of the <em>sun causes the mercury in the thermometre to rise up.","Use your measure box to measure how high the sun rises up."
44,"Nine plus a drop rounds it off to ten!","Watch out for <a href="/study/kanji/0.000000E+0050X0P+040X0P+0A">太</a> (<span class="frnr">#126</span>). Here Heisig could have added a &quot;t&quot; and we would have had a much better keyword : rotund</strong>. <strong>Rotund</strong> is more specific than &quot;round&quot; which begs for confusion with <a href="/study/kanji/0.000000E+005"Cut the tail off of a 9 and it will be round.","In nine months a drop of sperm can make a woman very round.","NINE plus a little DROP to round up to ten.","When I put my sperm drop in my wife she becomes round for 9 months.On : ガン Kun : まる.","Drop</em> off the tail of a Roman-written <em>9</em>, and you&#039;re left with something ROUND. ::::: <a href="/study/kanji/"Nine</em> is just a <em>drop</em> away from being a <em>round number.","An early name for baseball was Rounders. So, a variation on baseball (the drop).","Nine</em> and a <em>drop, let&#039;s just round it up to ten!"
45,"The decimal system uses drops</em> of <em>ten as a measurement.","Use two lines (X axis and Y axis) to measure the dot (on the graph).","Glue two sticks together to make the best measurement. (I always remember the primitive, but never the original keyword.)","Take your medicine, exactly ten</em> <em>drops. Picture yourself measuring it out with a pipette.","A single shaku is divided into 10 sun (寸). The original definition for shaku was the average distance between growth nodes on a bamboo. Thus a tenth of a shaku is a measurement.","Ten</em> <em>drops</em> of <em>glue, a measurement true.","A measurement of one tenth (a drop of ten) of a shaku, an archaic Japanese unit of length.","The metric system uses drops</em> of <em>ten as a measurement, a practice which will stick like glue, hooking at the end.","Decimal is measurement in drops of ten.","On an X-Y GRAPH, look in the 3rd quadrient for the correct measurement. (i like math &gt;.&gt;)."
46,"After you have chosen your 10</em> <em>fields</em> of study, <em>measure how good you are at each to find out your specialty.","10 brains glued together allows you to specialize in any specialty</strong> that you want. Imagine each brain having its own<strong> specialty.","She&#039;s so good at her speciality, it&#039;s like ten</em> <em>brains</em> <em>glued together.","I&#039;m a Rice Field Measurer! That is, my specialty is &#039;measuring&#039; &#039;ten&#039; &#039;rice fields&#039; at a time.","A person&#039;s specialty or field</em>, may change <em>up</em> to <em>ten</em> times before they finally settle <em>down</em> and <em>stick with their liking.","RTK II:　セン　専門家　せんもんか(a specialist) / Take ten</em> <em>fields</em> of study, and take a <em>measurement in which you are best. That&#039;s your specialty.","My specialty</strong> is a bit unusual. I can take ten rice fields and glue them together. It takes a lot of strength, and because I&#039;ve taken anabolic steroids for the past 20 years, I can do it. It&#039;s my<strong> specialty and no one else&#039;s.","Finding your specialty in life is very difficult. But imagine if you had ten brains glued together - then surely you figure out something!","My specialty is made up of ten</em> different <em>fields</em> of study <em>glued together.","I measured</em> up the <em>ricefield</em> <em>ten</em> times and it became my <em>specialty."
47,"Ten specialties grants you the title of Dr. with a dot.","Watch for <a href="/study/kanji/0.000000E+005"Needles</em> are a Dr.&#039;s <em>specialty.","Note: Use Ph.D.</strong> rather than <strong>Dr.</strong> to avoid confusion with <strong>doctor</strong> and to be more in line with common use of this kanji. Ten</em> <em>specialities</em> grants you the title of <strong>Ph.D. with a <em>dot.","Dr. Who weaves like a needle</em> through the fabric of time, to <em>drop in unexpectedly has become his <a href="/study/kanji/0.000000E+005"Ten years specializing (4 under graduating, 2 mastering and 4 taking Ph.D) makes you a Doctor, but it leaves with just a drop of hair in your head.","Problems really arise here (and later with dilute <a href="/study/kanji/0.000000E+008"It&#039;s not hard to think of a Dr. as a &#039;needle specialist&#039;.","A Dr. is somebody who specializes (専) in blood (&#039;) and needles (十).","I don&#039;t want 10 specialists, I just want my Dr. on the dot!!"
48,"Fortune-telling: using a mouth as a divining rod.","A great number of people who do fortune-telling are &quot;almost old&quot;.","To do fortune-telling put a magic wand</em> in your <em>mouth.","The mouth of a fortune-teller is a superior (above) mouth.","She is good at fortune-telling</strong>. With a divining rod</em> and her <em>mouth, (and by looking at the position of <strong>Uranus</strong> in the sky) <strong>she</strong> may <strong>SENSE the future. (Kun readings are urana and shi(me), ON reading is SEN).","The old fortune teller was missing an arm.","A magic wand</em> and a big <em>mouth... All needed to give a fortune-telling.","Note: This kanji is also used in &quot;monopolizing&quot; and monopoly &quot;一人占め&quot; and &quot;独占&quot;. I remember this with the famous Oracle of Delphi. It monopolized Greek fortunetelling for a very long time.","The mouth is telling what will happen above and beyond today.","Fortune-telling is a mouth that speaks above this plane."
49,"A magic wand standing on above the floor.","The divining rod</em> is above the <em>floor.","Water Faucet is ABOVE the Ground.","Whoa, that magic wand</em> is above the <em>floor by itself!","Zombies come above ground at night.","I hold my hand above my broom as I cry &quot;UP!&quot;","うえ … Ex バルコニーは通りの上に</strong>突き出している … The balcony sticks out<strong> above</strong> the street … どおり、つきだして … 平均以上 … へいきんいじょう (<strong> above-average) 「ショウ、うわ、かみ、のぼ.る」上着、上手 … うわぎ、じょうず.","A magic wand</em> floating above the <em>floor.","[ above</strong> = magic wand</em> / <em>floor</em> ] - a <em>magic wand</em> hovers <strong>above the <em>floor ... like magic.","Above / on the floor. Jou: 上手 (jouzu) Ue: 机の上 (tsukue no ue)."
50,"Roots are below the ground.","A magic wand hanging below the ceiling.","Peeing off a cliff &quot;Watch out BELOW!&quot;","The divining rod</em> is below the <em>ceiling.","This time the DIVINING ROD has been pushed below the ceiling deforming its handle.","A T with it&#039;s wang below.","下 = した	1: below; down; under; younger (e.g. daughter); 2: bottom; 下 = もと	under (esp. influence or guidance) 下す = くだす	1: to make (a decision); to pass (judgement, etc.); to hand down (orders, etc.); 2: to let go down; to lower; 下る = くだる	1: to descend; to go down; to come down; 2: to be handed down (of an order, judgment, etc.); 3: to pass (of time); 下り = くだり 1: down-train (going away from Tokyo); 2: down-slope; downward going.","Warning: BELOW my waste, a limp dick.","A plant&#039;s roots are always below ground.","した … ① 太陽は地平線下</strong>に没した … たいよう、ちへいせん、ぼっ.する … Sun went<strong> below</strong> horizon … 下がる、<strong>さ</strong>.げる-がる … ② 川の水位が<strong>下がった</strong> … かわ、すいい … 下る、<strong>くだ</strong>.る-す … ③ 彼女に有罪の判決が<strong>下った</strong> … ゆうざい、はんけつ … 降下、こうか … 「<strong>ゲ、しも」… 下品、げひん、下北沢、しもきたざわ."
51,"The most eminent magician is he who learned to use his magic wand early in life.","The world&#039;s most eminent sourcerer, Harry Potter, used his magic wand early in life.","When a car (　車　) <a href="/study/kanji/0.000000E+008"The eminent sunflower is the one that stands above the others.","The world&#039;s most eminent fortune-teller is also the earliest of all. He produces his predictions amazingly fast.","Eminent is above early.","Eminent wizards use their magic wands early.","Picture Yotsuba waving around a sunflower like a magic wand, dressed up like an eminent old wizard with a long fake beard.","An eminent magician is up early</em> with his <em>magic wand</em> (practicing <em>table tennis (卓球) against an enchanted paddle).","Wake up early</em> and practice with your <em>magic wand if you want to become an eminent wizard."
52,"There is mist as the moon fades away in the morning.","Morning has come &quot;ten&quot; hours &quot;early&quot;!!! The &quot;moon&quot; is still in the sky!","In the morning, god picks the sun</em> up to the sky with two <em>needles</em> (because it&#039;s too hot to touch by hands) to replace the <em>moon.","In the morning the mist</em> and <em>moon fades away.","The morning mist</em> is the <em>moon</em>&#039;s parting tears--sprinkling <em>ten early flowers with dew when she leaves the sky each day.","The morning sun has 20 times the power of the moon.","Morning = From moon to 10 in the day. --- Careful with this &quot;mist&quot;, as it&#039;s not the actual Kanji for Mist (霧). (I was almost fooled myself, heh.)","Mist</em> and <em>moon, it&#039;ll be morning soon.","At ten</em>, <em>early</em> in the morning, you can still see the <em>moon.","Every morning, the sun sprouts needles to scare away the moon."
