53,"Imagine an animal with only a mouth</em> and <em>legs.","My girlfriend insists that the only</em> thing I want from her is what&#039;s between her legs.. She&#039;s drawn me this pictograph to demonstrate. It&#039;s a <em>head and two legs spread apart.. I explain that I also love her breasts, and then she smacks me in the face. I&#039;ll never understand women.. (I keep failing this kanji, hopefully this silly story will help me!)","Only your mouth runs faster than your legs.","Tada</strong>!... <strong>SHE</strong> is the<strong> only</strong> animal with<strong> only a mouth</em> on <em>legs and no body! (Kun reading tada, ON reading SHI).","Men only want that mouth between the legs.","Kirby is the only</strong> one of his kind. He is basically<strong> only a walking MOUTH, with short ANIMAL LEGS.","ONLY one MOUTH for every two LEGS.","My &quot;one and only&quot; has a talkative mouth</em> and a nice pair of <em>legs.","Ordinary; common;<strong> only</strong>.</strong> COMMON OR ORDINARY PEOPLE<strong> ONLY</strong> LIVE HANDS</em> TO <em>MOUTH. 只言 (plain speech; direct speech); 只管 (just now); 只今帰りました (tadaimakaerimashita); 只事 (trivial matter); 只者 (ordinary person, neg.); 只取り (getting something for nothing); 只乗り (free ride); 只働き (working for free); 只言 (plain speech; direct speech); 只ならぬ (unusual, uncommon, extraordinary, alarming); 只只 (absolutely;<strong> only); 只の人 (man on the street; common person).","Once upon a time, men only saw women as walking vaginas."
54,"Eye</em> thought I saw a shellfish <em>legging it down the beach!","Stare at the shellfish, it looks like an eye with legs.","Remove the eyes</em> and the <em>legs, and a shellfish tastes great!","As a primitive this is very often best interpreted as &quot;Old Money,&quot; for example: bribe [80] (possessing old money), tribute [81] (the craft of making old money), rule [88] (old money was ruled by the sword), savings [194] (old money stored in the house and nailed under floorboards), failure [331] (to avoid failure in creating old money a hard taskmaster was needed)... The list goes on.","The guy</strong> couldn&#039;t <strong>BUY</strong> any<strong> shellfish</strong> which had one giant eye</em> and walked on <em>animal legs, so he went out in his <strong>kayak to catch some. (Kun readings are kai or gai, ON reading is BAI).","SHELLFISH look like big eyes</em> with <em>legs.","Ah! A one-eyed</em> shellfish&#039;s running along the beach on its little <em>legs</em>, terrifying tourists. As a primitive, this can mean <em>shells</em>, <em>oyster</em>, or <em>clam.","That shellfish looks like a big eye</em> with <em>animal legs.","Shellfish (when its open a bit) looks like huge eye</em> with little <em>legs sticking out of it.","Remember this as your &quot;money&quot; radical. shellfish - money. in the olden days, people traded shells as money."
55,"A magic wand</em> is needed to make a <em>clam stand upright.","Just the thought of my magic wand</em> on her <em>clam</em> makes my <em>magic wand stand upright.","貞 【てい】 (n) (1) firm adherence to one&#039;s principles; (2) chastity (of a woman) what this has to do with &quot;upright&quot;... not sure. but heres a story for CHASTITY: &quot;a magician uses his MAGIC WAND to shut the crotch of a maiden as tight as a CLAM, to protect her CHASTITY&quot;.","To get the shellfish</em> to stand upright, just poke it with a <em>magic wand!","Careful! This means upright in character, not in position. So although the magically standing shellfish is a cute image, it doesn&#039;t convey the right meaning. This character is mainly used to represent a woman&#039;s chastity, purity or fidelity, so I just associate chastity</em> with <em>magic oyster.","An UPRIGHT person is above</em> (上) petty disputes, and always holds their head <em>up</em> (上). Since they live on principle, they are as hard or firm as a <em>shell</em> in their beliefs of what is right and what is wrong. They are wise, because they find the pearls of wisdom in the <em>shells of life; 童貞 (virginity); 不貞 (unfaithful); 貞はる (harp too long on a subject); 貞淑 (chastity, virtue); 貞女 (virtuous woman); 不貞寝 (stay in bed out of spite); .","Harry Potter is an upright citizen that would not use his wand</em> to steal <em>money illegally.","Eating shellfish</em> will make your <em>magic wand stand upright.","The upright/chaste maiden used her magic wand to escape from the evil shellfish gang. [貞 【てい】 (n) (1) firm adherence to one&#039;s principles; (2) chastity (of a woman)] (thanks to romanrozhok for the definition).","The TA</strong>LE <strong>said</strong> that touching a magic wand</em> to the top of the <em>shellfish</em>&#039;s <em>eye</em> will make it walk<strong> upright</strong> on its little <em>animal legs. But it was just a <strong>joke. (ON reading TEI, kun reading sada, other reading JOU)."
56,"An employee</strong> (<strong>member of the company) has to clam up his mouth if he wants keep the job!","An employee is basically a shellfish with a mouth.","An employee</strong> is a worker. They lend their mouth</em> (口) to spread a message &amp; sell products; <em>eyes</em> (目) to watch competitors &amp; find customers; and <em>eight</em> (八) hours a day. Alt., an<strong> employee</strong> is a <em>shell</em> (貝) in the ocean of a company; it looks up to the boss&#039;s <em>mouth (口) for orders. 医員(doctor); 一員(member); 駅員(station attendant); 委員(committee member);会社員(company<strong> employee); 海員(sailor);楽員(band member); 期間契約社員 (fixed term contractor).","Employees work and earn clams so that they can feed their mouths.","An employee is not a robot (Calculon&#039;s friend), he&#039;s got a mouth</em> to feed. Pay him more than a few <em>clams!","&quot;But sir, It&#039;s a shellfish with a mouth!&quot; &quot;I don&#039;t care! He starts monday!&quot;","That new employee better clam</em> his <em>mouth shut before he gets fired.","A good employee keeps his MOUTH shut as tight as a SHELLFISH. 社員　しゃいん.","Picture the poor employee at the seafood restaurant, forced to stand outside in a giant crab</em> costume with only his <em>mouth showing.","If you&#039;re an employee</strong> you need to watch your mouth</em> 口 and <em>clam 貝 up. 会社員、かいしゃいん, company<strong> employee."
57,"As a primitive, this is Mike Wazowski from Monsters Inc. (the giant eyeball</em> with <em>legs</em>...) Makes for <em>easy stories later on.","Eyes and legs are all you need to see the world.","Men&#039;s eyes</em> open wide when they see</strong> the <em>legs</em> of a beautiful woman. (Alternatively, women&#039;s <em>eyes</em> open wide when they<strong> see the <em>legs of a handsome guy ;) ).","The large eye</em> on <em>human legs sees all!","見る, 見える, 見せる <a href="/study/kanji/0.000000E+0080X0P+06"I see best when I am walking!","Although <a href="/study/kanji/0.000000E+005"Using our eyes</em> 目 lets us walk around on our <em>human legs 儿 and see</strong> things. 見る、みる, to<strong> see; 見どころ、みどころ, highlight, attraction, best part: 梅の花は今週が見どころです, &quot;The plum blossoms are at their best this week.&quot; 見物、けんぶつ, sightseeing, a visit: 明日は美術館を見物する予定です, &quot;Tomorrow I&#039;m planning to visit the art museum.&quot; 見物人、〜じん, a sightseer.","I want to see Japan with my own eye on my own two feet.","Eye</em> (I) see <em>legs."
58,"In the olden times</em>, a newborn babe came out <em>legs first.","In the olden times</em>, a newborn babe came from between the <em>legs. Now we have cesarean section. [modified rakutenka&#039;s story].","In olden times newborn babes were strapped to their mothers&#039; backs, leaving both their legs dangling.","The man from olden times</strong> has been reincarnated with a new pair of <strong>human legs.","A newborn babe is an 18 year commitment that will have you running</em> for <em>olden times!","In olden times</em>, before I could walk on <em>human legs, I was just a newborn babe.","It is said, that in the OLDEN DAYS, NEWBORN BABES could walk on their LEGS when they are only 1 day old.","This just looks exactly like a newborn babe as viewed from the side, crawling to the left. The head on the left, the nappy on the right, the little arm bending forwards and his little leg bent at the knee as he crawls along.","After 18</em> hours of labour, the newborn babe came out <em>legs first (育児).","Old</em> Father <em>time</em> usually has a newborn babe at his <em>feet to signify the cyclical nature of time."
59,"In the beginning were just two</em> who walked on <em>human legs.","In the beginning God created woman, and God asked her how she liked his work. Woman replied, &quot;Well, you know how I have two</em> eyes, <em>two</em> arms, <em>two legs</em>... it seems redundant to have three breasts. It would look more symmetrical with <em>two</em>.&quot; God nodded, and the middle breast fell off... and it was good. Woman picked up the breast and said, &quot;Thank you, God! But what do I do with this useless boob?&quot; And God created man. That&#039;s why the women today only have <em>two</em> boobs to match their <em>two human legs.","Every journey begins with your two legs.","Grandpa Woody always began stories from his youth with &quot;In the beginning, when I had two</em> <em>legs...&quot;","Two legs are the beginning of human evolution.","Ready ( 一 ) Steady ( 一 ) Go! (legs). This is a start, a beginning.","In the beginning we start out with nothing but our own two legs.","In the beginning there were two</em> humans with legs (<em>human legs!) Adam and Eve.","With two pairs of legs we can see the beginning of a lot of good old sex.","Everyone&#039;s beginning is the same, those TWO lips at the top of your mother&#039;s LEGS."
60,"A shellfish</em> carrying a page balanced on its <em>head.","One</em> <em>drop</em> of ink from a <em>shellfish can fill a whole page.","A shellfish</em> dangles from the <em>ceiling Mission-Impossible style, desperate to recover the page of revealing images that were taken from him.","頁岩, 頁, <a href="/study/kanji/0.000000E+0090X0P+00"One</em> page may not seem like much, but if it contains <em>drop</em> of wisdom, it is worth the <em>clams</em> you <em>shelled out for it.","Excuse for not handing in homework: &quot;the shellfish ran off with a page from my notebook.&quot;","A shellfish</em> scurries off with a page of the treasure map on it&#039;s <em>head.","Our shellfish is balancing a PAGE on its top edge, but it&#039;s cheating! Look, there&#039;s a drop of glue holding it there!","A shellfish</em> dangling on the <em>ceiling is all over today&#039;s front page!","Front page</em> news: <em>shellfish</em> <em>drops</em> from <em>ceiling!"
61,"A stubborn person in the beginning</em> gets something into their <em>head and can&#039;t change their mind.","Picture a STUBBORN schoolboy, with his arms crossed and his book still open to the BEGINNING PAGE. Despite the teacher telling him to turn the page, he refuses and keeps his book on the BEGINNING PAGE.","He&#039;s so stubborn, he won&#039;t read past the beginning page!","Stubbornness begins in the head.","ガン Stubborn</strong> = determined not to change your opinion or attitude. If you are<strong> stubborn, the opinion or attitude you had from the beginning</em> is firmly rooted in your <em>head and will not change. 頑張る　（がんばる）　persist; be tenacious; hold out; 頑固な　（がんこな）　stubborn; obstinate; bigoted.","I tend to be STUBBORN if the first (beginning</em>) <em>page of a book is not good.","People are very stubborn in their interpretation of the beginning page of the Bible.","In the BEGINNING</em> I was very stubborn with my kanji practise: now I am on a roll, I am whizzing through each <em>PAGE of Heisig&#039;s book.","A stubborn</strong> person never wants to go beyond the first</em> 元 <em>page 頁, or to change his head from its original state. 頑張る、がんばる, to persist, hang in there (+ lengthen), e.g. 頑張って下さい、がんばってください; 頑固、がんこ,<strong> stubborn, hardheaded.","Too stubborn</strong> to read even the <strong>Beginning</strong> of the <strong>Page."
62,"Is there anything as mediocre as a drop of piss in the wind?","A drop</em> of breeze is naught but a mediocre <em>wind.","A drop of rain in the wind... what a mediocre rainy season...","Mediocre people hide under the table.","All we are is Dust in the Wind- a great example of a mediocre song.","Nothing is more mediocre than a single drop in the wind.","There&#039;s no A in mediocre.","As mediocre as a drop</em> in the <em>wind.","A little droplet of fart floating in the wind is a mediocre attempt at flatulence.","We are as mediocre as a drop of dust in the wind. (Think Kansas - Dust in the wind)."
63,"Tied up</em>, the <em>shellfish had to accept defeat!","The shellfish</em> admitted defeat when they placed a <em>hook on top of his head.","A shellfish bound up in a fisherman&#039;s net has been defeated.","Defeat is defined by a shellfish in binds.","If you are DEFEATED you are BOUND into slavery and the world will not be your OYSTER.","In these days it&#039;s obvious: if you tie up</em> your <em>money in the wrong place, you&#039;ll have to accept defeat.","The defeat</strong>ed man took the bound</em> <em>money</em>purse full of <em>clams from his belt and cast it at the feet of the victor to concede<strong> defeat.","Since I was DEFEAT</strong>ED in the game, I had to bundle up my money to give to the winner.　相手を負かす＝あいてをまかす＝ to<strong> defeat the opponent.......... お負け=おまけ= freebie (e.g. with a purchase); something additional; bonus; an extra; exaggeration o フ k まける k まかす k おう.","負ける、ま</strong>-かす-ける … ① 私たちは野球で彼らを<strong>負かした</strong> … やきゅう … We<strong> defeat</strong>ed them at baseball … ② 彼は決して<strong>負け</strong>を認めないだろう… けっして、みと.める … He will never admit<strong> defeat</strong> … 勝負 … <strong>しょうぶ</strong>- <a href="/study/kanji/0.000000E+005"It&#039;s easy to defeat a shellfish</em>, just <em>bind it up sturdily and it will be down for the count."
64,"I bound</em> ten thousand dollars together and hid it under the <em>floor.","It looks like a T and an H put together.","IT&#039;S OVER 9000!!!!!!","We have &quot;one&quot; at the top and if you turn the kanji 90 degrees you will see arabic 4 shich means it has four zeros in front of it!","Looks like T</em> and <em>h</em>, sharing the same stem.. <em>Th are the first two letters in thousand.","Think of Tao: ten thousand things are all bound up</em> into <em>one.","This kanji makes me think of money in Japan. two primitives: &quot;one&quot; and &quot;bound up&quot; Put them together by thinking of 10,000 yen notes bundled together in batches, each batch with one note wrapped around it rather than a rubber band or string, etc.","T is for TEN as Th is for a THOUSAND.","I was bound for ten thousand years to the ceiling!","[ ten thousand</strong> = one</em> / <em>bound up</em> ] - <strong>ten thousand is the first (<em>one</em>) bundle (<em>bound up) of numbers in Japanese numeracy; cf <a href="/study/kanji/0.000000E+00465,"Some Japanese phrases are difficult to wrap</em> your <em>mouth around.","A bound mouth cannot utter a single phrase.","A phrase is a bunch of bound up words coming out of a mouth.","I use my mouth</em> to <em>bind words together, thus forming a phrase or sentence (句).","Phrase; clause; sentence; passage; paragraph.</strong> This Kanji has two radicals: (1) mouth (口); and (2) the wrapping enclosure (勹). To master a<strong> phrase, you must wrap</em> your <em>mouth around it.","A tricky phrase can bind up</em> your <em>mouth.","Bind</em> your <em>mouth in case the wrong phrase gets out.","[FR]phrase japlt:N1 KU</strong> kanji&amp;kana:337 paquet+bouche Les mots mis en <strong>PAQUETS</strong> au fond de notre <strong>BOUCHE</strong> deviennent à la sortie des <strong>PHRASES</strong>俳句【はいく】haiku poetry (poem in 3 lines of 5, 7 and 5 syllables)四字成句【よじせいく】Chinese four-character<strong> phrase</strong> or idiomatic expression語句【ごく】words;phrases成句【せいく】idiomatic<strong> phrase句読点【くとうてん】 punctuation marks引用句【いんようく】citation.","The phrase was BOUND around his MOUTH.","A phrase is words that get BOUND UP into a group before they come out of your MOUTH. 俳句　はいく poem (one kind of)."
66,"When you expose your flesh</em> to the <em>wind it gets textured: goosebumps!","The moon</em>&#039;s lack of <em>wind preserves its texture.","Because the moon</em> has no <em>wind the texture of it&#039;s cratered surface never changes or erodes.","The Moon And The Wind Create The Sea&#039;s Wavey Texture!","はだ　TEXTURE; SKIN. ”The FLESH (part of the body) that you expose to the WIND is your SKIN (note the order), which eventually becomes textured as a result of such exposure.&quot; Eg.　鳥肌が立つ　（とりはだがたつ） to get goosebumps. 肌寒い　chilly.","A month of wind changes the texture of your skin.","The texture</strong> of your flesh</em> 月 is roughened by the <em>wind 几. This also means <strong>skin</strong>. 肌色、はだいろ, flesh-colored; 肌着、はだぎ, underwear, clothing worn next to the <strong>skin; 地肌、じはだ, surface of the ground, the skin.","Moisturizer helps protect the flesh</em> from having a texture from being in the <em>wind.","FLESH + WIND = TEXTURE</strong>D=SKIN_____ FLESH affectd by wind, changes the<strong> texture</strong> of the SKIN. Also: 肌 【はだ】 (n,n-suf) (1) skin; body; (2) grain (e.g. of wood);<strong> texture;.","The moon seems to have a different texture in the wind."
67,"Hint: Here&#039;s info from Wikipedia regarding why this kanji exists, which helped me remember it: [Japan also divides the month roughly into three 10-day periods. Each is called a jun (旬). The first is jōjun (上旬); the second, chūjun (中旬); the last, gejun (下旬). These are frequently used to indicate approximate times, for example, &quot;the temperatures are typical of the jōjun of April&quot;; &quot;a vote on a bill is expected during the gejun of this month.&quot;].","Hesig should be BOUND for a DAY (or maybe 10 days - a decameron</strong>) for calling this Kanji<strong> DECAMERON. See <a href="/study/kanji/0.000000E+0060X0P+0E"What the fuck?","If you bind up ten days, you get a decameron.","For producing Titanic, James deCameron should be bound for 10 days.","HINT: All the stories seem to have &#039;10&#039; in them, but the primitive isn&#039;t featured, which is confusing. So my story: How many days were bound up in a decameron? It doesn&#039;t matter!","It would tie up a whole day to read The Decameron.","Heisig should be bound</em> up for 10 <em>days</strong> for calling this kanji<strong> decameron!","The Japanese divide the months into three parts. Each part is made up of ten days. The day</em>s are <em>bound together so they make more sense.","Decameron; 10day period; season (in the sense of &#039;fish&#039; or &#039;fruit&#039; season).</strong> The<strong> decameron</strong> is a story of ten days</em> which are <em>wrapped</em> or enclosed in a single text. Another way to look at this Kanji is to think of the fishing <strong>season, when fresh fish are <em>wrapped</em> (勹) up and sold at the market every <em>day (日)."
68,"A ladle binds drops together.","Forget about the primative &#039;bound up&#039;. Imagine instead the shape of a ladle and holding it upside down to drink the last DROP (of water).","I&#039;m bound and determined to get that last drop with this ladle!","勺<a href="/study/kanji/0.000000E+005"In the SHACK</strong>, a single drop</em> was <em>bound up in a<strong> ladle. (ON reading is SHAKU).","A ladle holding a tiny fart.","There&#039;s always bound</em> to be one <em>drop left in the ladle.","Liquid can&#039;t be completely bound up</em> in ladle, so a <em>drop is bound to spill.","Un cucharón se usa para empaquetar</em> las <em>gotas de la sopa y llevarlas a tu boca.","The last &#039;drop&#039; is &#039;bound&#039; to be in the ladle."
69,"I managed to hit the bull&#039;s eye by throwing my white ladle.","A white</em>, <em>bound up</em>, <em>drop in the center is the bull&#039;s eye. (why Heisig had to use &quot;ladle&quot; instead of the original two primitives that make up &quot;ladle&quot; I&#039;ll never understand!)","You&#039;re outside at a BBQ making the white sauce to go with whats on the grill. You lift the ladle to your lips. Right after you close your eyes to take a taste, a drop of white bird shit falls into the ladle - &quot; Bull&#039;s Eye! &quot; the bird says. Not seeing the incident, you proceed to taste your &#039;white sauce&#039;.","This kanji is used most commonly for 的（てき）or teki</em>, which is the Japanese equivalent to the English suffix &#039;-ly&#039;. Example: 基本的（きほんてき）or <em>kihonteki</em>: <em>kihon</em> means &#039;basic&#039; or &#039;standard&#039; so <em>kihonteki means &#039;basically&#039;.","He scooped out the bull&#039;s eye with a white laddle.","Bull&#039;s eye! I shot my white</em> stuff in the <em>ladle!.","A white</em>, <em>bound up</em>, <em>drop in the center is the bull&#039;s eye.","The white bird</em> kept pecking at my sandwiches, so I grabbed a <em>ladle from the picnic basket and threw it at him. Bull&#039;s eye!","In Japanese archery the BULL&#039;S EYE is white</em> and about the size of a <em>ladle.","If a WHITE bird flies in though the window, hit it with the LADLE and shout &quot;bull&#039;s eye!&quot;"
70,"The V shape is your neck on top of your collar bone, or the straight line. Yourself, or the rest of your body is below that!","One has a strong NECK if one can carry HORNS on ONESELF.","There are no goddamn animal legs in the Kanji for neck</strong>. Stop thinking there are animal legs in the Kanji for<strong> neck. There are NONE!","When I think of a neck, I think of a giraffe. This kanji is just a pictograph of giraffe&#039;s face, with those little horns</em> on top and a big <em>nose.","With horns on oneself, you need a strong neck.","Nose is under horn. What&#039;s under nose? That&#039;s the neck!","Pshhh, drawing a neck is easy; just put two marks on a page.","necking will make oneself horny.","目自貝頁夏首 quite similar.... 1. 目 looks like an EYE 2. 自 referring to ONESELF by pointing just a drop away from your eyes, to your nose like Japanese do 3. 貝 Kanj looks like a SHELLFISH 4. 頁 one drop of ink from a shellfish fills a whole PAGE 5. 夏 one drop of sweat in your eye while running reminds you that it is summer 6. 首 horns on top, than the nose and than the NECK</strong>. (Be careful, many stories say 頁 means &quot;head&quot;. No, 首 means<strong> NECK and can also refer to head.)","Horns</em> on <em>oneself</em>. In France <em>horns</em> are a symbol you&#039;ve been cheated on (in other cultures too I think). Personally, I&#039;d rather have my head chopped off at the neck</strong>. (Or, story #2: <em>horns</em> on <em>oneself seem pretty heavy to carry and are sure to give you a very sore<strong> neck!)"
71,"This is a fish hook, that pulls out the fishguts.","Really this will rarely be seen as fishguts as a Kanji, usually it&#039;s 2nd party, or latter, generally always meaning 2nd in some way. It&#039;s easy to remember this as &quot;2nd&quot; since it looks like a 2. Then just remember it&#039;s a fishhook primitive like any other kanji that changes it&#039;s meaning as a primitive.","&quot;Knife goes in, guts come out&quot; (-Bart Simpson&#039;s mantra as he guts fish in &quot;30 Minutes Over Tokyo&quot;). To be more specific: first, cut a 乙-shape in the belly of the fish, second, pull the fishguts out. (Note that the most common meaning of this kanji is not &#039;fishguts&#039; as Heisig connotates, but &#039;second&#039;).","You cut a fish in a z shape on the belly to make it easier to open the fish and rip out its fish guts silly!","Fishgutz.","Fishguts</strong> are my <strong>2</strong><strong>nd favorite food.","Imagine if the Zodiac Killer targeted fish instead of people. He would kill fish and leave fishguts spewing all over the scene of the crime. Then he would leave his infamous mark: the mark of the Zodiac. (A slightly curved Z).","Zorro left his initial in the fishguts.","FishgutZ!","Ze fish are caught weeth ze fishgut bait on ze hook."
