0,1,2,3,4,5,6,7,8,9,10
1,"One down, 2041 to go. ;).","This one is too difficult to remember. If the other Kanji are this difficult, I&#039;m giving up.","To learn this one kanji, I <a href="/study/kanji/0.000000E+008"A sleeping Roman I. ;).","One</strong> Line to Rule Them All,<strong> One</strong> Way to Write it;<strong> One Stroke From Left to Right, and With a Pen Lift, Bind it.","Tips for your journey:1)check the keywords (for example with saiga-jp kanji dict or jisho.org or http://dic.yahoo.co.jp + rikaichan). heisig messes up a lot. 2)you&#039;ll get mixed up if you use too many penis euphemisms. i try to stick with just &quot;crotch&quot; for penis. 3)try to use the right meaning of the keyword in your stories. for example 抄&quot;extract&quot; is like an excerpt, not the verb extract.","One</strong> stroke means<strong> one. Simple, yes?","Be sure not to confuse this kanji with 鬱 !","One.","The one-liner."
2,"Two lines.","No wonder the hotel room only cost TWO yen, all it had was a ceiling</em> and a <em>floor.","Roman numeral II, written on its side.","With this one, I have doubled the number of kanjis I know. Next please ;).","Two</strong> =<strong> Two</strong> =<strong> Two</strong> =<strong> Two</strong> =<strong> Two (get it?)","1+1 = 2.","Two Romans are sleeping together.","More tips: 4) You might want to check out Katsuo&#039;s extra keywords: http://forum.koohii.com/viewtopic.php?id=2519 to find commonly occurring combinations which Heisig does not give a name too. In particular, I found it useful to name ten+sideways eye as in 壊 (Darth Vader is a common name for this) and the big flower and small water of 薄, etc. to differentiate it from 漢, etc. (see http://forum.koohii.com/viewtopic.php?id=1079). I like to use seaweed because 藻.","1. ni に ex: 2 houses にけん niken (二軒) 2. futa ふた ex: 2 people ふたり futari (二人) *Note: 二日 futsuka　ふつか　means &quot;2 days&quot; or &quot;the 2nd day&quot; of a month.","Further along, hidden slightly were two lovers, one lying atop the other."
3,"One + two = three.","THREE measurements define the female shape: BUST, WAIST, and HIPS. Waist is the smallest, and for most women the HIPS are wider than the chest.","One (一) on top of two (二), gives three (三).","A threesome: a Roman girl getting sandwitched by two blokes yelling &quot;me too!&quot; (みつ).","A Roman family sleeping together horizontally.Can&#039;t you see the kid between his parents?","The roman numeral III laying on its side.","A threesome: a Roman girl getting sandwitched by two blokes yelling &quot;me too!&quot; (みつ).","1. san　さん ex: 3 people さんにん sannin (三人) 2. みっ ex: みっか mikka (三日) means 3 days or the 3rd day of a month.","Three</strong> is the number that thou shall count and the number of the counting shall be<strong> three.","一 + 二 = three</strong>... [SAN, mi-tsu, mit-tsu:<strong> three]... KF4/DR3072."
4,"FOUR year-olds often put their FOOT (human legs) in their MOUTH - but they are too young to realize.","I imagine a giant devouring a human in four</strong> bites. First the giant bites off the person&#039;s head, then he bites the torso, then from the waist to the knees, and finally the giant plucks up the remaining portion of the human legs into his mouth. See the<strong> fourth bite falling in there?","This is a picture of a slab in the morgue. It is pulled out from the drawer, and it is showing only the dead person&#039;s feet. Clearly shi means DEATH.","A man inside four walls.","Four are the legs</em> of the Schrödinger Cat, which is kept in a <em>box, and you don&#039;t know if the cat is dead or alive until you open it.","Be-YON-ce shows off her legs be-4 SHI opens her mouth.","The monster MOUTH eats the HUMAN LEGS in just FOUR bites.","A four months old baby will try to put his feet (human legs</em>) in his <em>mouth.","The show curtains open at FOUR.","There are FOUR directions in which your mouth can tell your legs to walk."
5,"三 + two vertical lines = 5.","Five</strong> - has a THREE, and a small &#039;h&#039;... &#039;high<strong> five&#039;.","This Kanji looks like a &quot;3&quot; Kanji with two added vertical lines. 3+2= 5.","The letter &#039;F&#039; is skiing for the &#039;five&#039; trophies.","三 + II= 5.","The King</em> (<a href="/study/kanji/0.000000E+0070.000000E+00"Five lines to make up ceilling, floor and chair.","If you look closely, you can see that this is a picture of 3 and 5 together on a sled. 5 is in front, this entire thing was his idea. Terrified 3 is only along for the ride in the back of the sled thinking &quot;How did I let 5 talk me into this???&quot;","If you look closely, you can see the number 5 in this kanji.","Some T (tea) for ユ (you, katakana yu). I personally enjoy drinking the stuff five times a day."
6,"Indicating 6 parts of the human body: head, body, 2 arms, 2 legs.","The Devil, always a gentleman, wears a top hat, but his goat legs, betray the Beast. 666 is his number.","Six-Six-SIX ((666)) Mark of the Beast!! Imagine that dapper old beastly fellow summoning his top hat to himself. See it scamper over to him on a little pair of beastly legs.","A top hat with animal legs is clearly the work of the devil. Six</strong><strong> six</strong><strong> six!","Someone lying spread-eagle, ready for &quot;sex&quot; ( SIX</strong> ). —or— Hey, everyone! Come see! I just trapped a<strong> SIX-inch gremlin under my top-hat!","The six members of a person, however the torso was eat by the devil (666).","Eight owns six hats.","This Kanji looks like a little insect crawling along, and as we all know insect have six legs.","Six animal legs</em> sticking out from under the <em>top hat - that&#039;s gotta be some huge insect!","Here are 6 parts of the human body: head, body, 2 arms, 2 legs, however the torso was eaten by the devil (666). [thanks fesgo and andre_breton]."
7,"This kanji is our good old seven, turned upside down.","I wrote it upside down so I crossed it out.","Almost katakana SE = SEVEN.","I crossed</em> it out because I wrote this SEVEN <em>upside down.","If you take the line in the middle out, it&#039;s an upside down seven, Ta-da!","My NANA can&#039;t do exercise number 7, so SHICHI-ts.","Sailing the seven seas - the kanji bears resemblance to one of those old Viking ships they used to sail to America with.","Upside down European 7.","An upside down 7 being &#039;cut&#039; (切) in half.","This is how I write the number seven, only upside-down."
8,"&quot;Hachi&quot; (eight) begins with the sound of the katakana &quot;ha&quot;, and it&#039;s approximately the same character.","The valcano hasn&#039;t erupted for 8 years.","The curtains close at eight.","I eight something so large, it bent my chopsticks.","I eight a volcano! now I got heart burn.","Looks like ハ (and eight is pronounced ハチ）.","A girl who has been with eight guys last night.","This dangerous volcano erupts every eight minutes!","The spider lost 2 of it&#039;s eight legs.","Eight (8) lying down is the symbol of infinite. This almost-parabola opens up to infinite."
9,"Kinda of looks like the kanji of 1　一 with the kanji of 8 八added. So think of it as 一＋八＝九.","Warning - naughty reminder A woman in the doggie style position, waiting for my NINE inches.","It looks like an elaborate letter &quot;n&quot; for nine.","Girl waiting in doggy-style position for her boyfriend. If only she knew back then she would get pregnant and would have to carry a baby for nine months!","Nine baseball players, bowing low on the ground on hands and knees, before the game starts. おねがいします！.","九i九e.","No. 10 got hooked, leaving only 9.","If you pay atention to the first stroke, and half the second one, you can see a katakana ナ, which stands for 「ナイン」 (piece of cake, isn&#039;t it?)","Think of the Nine</strong> Ringwraiths from Lord of the Rings, and associate<strong> Nine with the similar-looking Power</em> (力) . (I find <em>ringwraiths to be a useful extra radical meaning for 九 sometimes).","A man standing to the left, holding a 9 iron golf club."
10,"Two needles crossing marks the spot, or you can use the Roman character for ten (rotated 45 degrees).","I scared away ten vampires with a single cross!","A roman ten (X) standing on one leg.","Ten looks like a plus sign.","T for ten.","Little t is for 10.","Ask ten</strong> men what the cross means to them and you&#039;ll get<strong> ten different answers.","1 cross and 10 commandments.","Roman Numaral for ten X flipped on its side.","Jonny Depp as Edward Needle</strong>hands has<strong> ten</strong> <strong>needle</strong>s for fingers. He shows you first one hand with the needles pointing from left to your right, then he crosses that with his second hand pointing down to cut someones hair (but he can only scratch their head because he has<strong> ten needles for fingers)."
11,"Looks like a huge open mouth.","When you sneeze, your MOUTH forms a square, and you make a noise that sounds like (KUCHI).","If you say &quot;kuchi&quot; one more time, I&#039;m going to box you in the mouth. (&quot;kuchi&quot; is how your pronounce this kanji, box is the memory symbol ).","（つ゜口゜）つ（Insert something yummy here).","Momma used to say: &quot;Keep your trap shut!&quot; This thing is shaped like a trap door.","Sponge Bob Square Mouth.","An open mouth.","OMNOMNOM.","An aunt&#039;s open, puckering lips saying kuchi-kuchi-koo over her baby niece.","To the baby: &quot;What a beautiful mouth you have. KUCHI KU.&quot;"
12,"Open the window, new day.","Picture two halves of a 24-hr period: Day &amp; Night.","=sun; day</strong>： Each time the SUN rises a new<strong> DAY</strong> begins. <a href="/study/kanji/0.000000E+006"Open window because its a sunny day.","On Sunday, church-goers sings hymns, their tongues wagging in their mouths.","The day is divided by AM and PM which is represented by the line.","The day</strong> that I open my window and the sun actually looks like this is the<strong> day that I know I&#039;ve been in Japan too long.","Ｄａｙ　＝　ニチ　/　ニ　/　ひ　/　び.","Sun...day.","An open window for a beautiful day."
13,"A month is longer than a day.","Am I the only one who sees this as someone sticking their ass in the air &quot;mooning&quot; someone (two cheeks of the butt and the legs coming off of it)? The Moon meaning connects well to the meaning of month</strong>, considering that<strong> months were traditionally measured by the phases of the moon. Also, the mooning &quot;ass&quot; part of it connects well to Hesig&#039;s seemingly unconnected &quot;flesh&quot; or &quot;part of the body&quot; meaning (when used in primitive form).","Month - every MOON cycle, werewolves eat FLESH, and other PARTs OF THE BODY.","Once a month, the moon is full.","A month is a movement (legs</em>) of <em>days.","A day grows swiftly into a MONTH as if sprouting legs.","Every MONTH the MOON completes its cycle from new to full. ｛ゲツ、ガツ、つき｝月（つき)moon, 月曜日（ゲツヨウび）Monday, 一月（イチガツ）January.","A month is longer than a day.","Theres a full Moon every Month.","You GATSU to shave your legs every day for a month. That TSUKI. Reading: ゲツ; ガツ; つき January: 一月= いちがつ."
14,"A rice field divided into four parts.","Ten</em> people use their <em>mouths to eat the yield of the rice fields.","Ten</em> rice fields can feed many <em>mouths.","A farmer must use his brain to measure out a 4-plot rice field.","Rice fields are split in four sections--one for each season!","One day the farmer is neatly digging his rice field</strong> chopping down with his spade in two directions at 90 degrees, when suddenly there is a crunching sound as he has chopped twice into the skull of a dead body exposing the <strong>brains sliced into four pieces. Ughhh !","A person&#039;s brains and a rice field are alike. If they are nourished, both will flourish.","Rice fields feed many mouths.","A rice field can feed 10</em> <em>mouths.","Ｒｉｃｅ　ｆｉｅｌｄ　＝　た ｅｘ： 田中ーさん　=　ｔａｎａｋａ－ｓａｎ."
15,"目_目.","There are 3 sections. Imagine the outer two being the whites of your eye. The middle is the pupil. Fill it in with imaginary color.","This one comes from an ancient character that was an eye</strong>. It is an<strong> eye</strong> rotated in 90 degree but got squared (think about anime style<strong> eyes).","目_目.","(目 ‿‿ 目).","Look at those tears in eye</strong>s. You <strong>moku me cry! .·目_目·.","This is an EYE</strong> with two<strong> eyelids and no pupil.","(目_目).","An eye</strong> with two<strong> eye</strong>lids and the<strong> eyeball in the middle.","Don&#039;t MOKU ME climb up there and punch you in the eye and three times in the mouth."
16,"Tombstone and cross on an old man&#039;s grave.","You get OLD fast if you have ten open mouths to feed.","Old people tend to talk a lot. Almost as if they had TEN MOUTHS!","The old man had only 10</em> teeth in his <em>mouth.","A story is OLD when it has been told by TEN MOUTHs.","After hearing it from ten mouths, a story gets old.","A cross on top of a tombstone --- old on: コ　( ko ) kun: ふる,　ふる。す (furu-i, furu.su).","As old</strong> as a story that has been told by the mouths</em> of <em>ten different generations. (you can see this kanji as an<strong> old tombstone, but don&#039;t associate it to an aged person).","Ten voices (mouths) prayed at the old grave.","A story told 10 十 times by the same mouth 口 gets old."
17,"I have 5 senses.","I eat five times at day.","I consist of five</em> senses to observe, one <em>mouth</em> to speak. <em>For order, remember that observing through the senses should be done before using one&#039;s mouth.","I have two eyes, nose, two ears = 5 plus one mouth.","I can fit all five of my fingers in my mouth! :D.","Descartes said, &quot;I think; therefore, I am,&quot; but this kanji implies, &quot;I sense; therefore, I am.&quot; 5</em> <em>openings symbolize the 5 senses.","I perceive the world through a window</em> (口) of <em>five (五) senses.","Panch dhatu pasun banloy Me (I) Panch Indriya pasun banlela mi It Actually means Panch Dhatu(Sanskrit) means....Five Minerals which i am made of. (avoid if complicate to understand).","I have 5 openings in the head, the lower one being the mouth.","Luckily I don&#039;t have FIVE MOUTHS!"
18,"Don&#039;t look at the sun directly with your eyes, it&#039;s risky!","You&#039;ll risk your eyesight if you look up at the sun.","Looking up at the big sun is a risk</strong> to your eye. To remember that the sun primitive is bigger than the eye primitive, imagine making your eyes little (squinting) when you go out in the bright sun to reduce the<strong> risk</strong> of getting sun blindness. READING: imagine a kid saying &quot;oh that&#039;s ぼう (bull as in B.S.), looking at the sun is no<strong> risk!&quot; [he&#039;s blind now].","Staring into the big sun</em> can risk</strong> your <em>eyesight! HINT: It looks like a pipe from Super Mario Bros. It might be<strong> risky to go down it. :p.","Look up at the SUN, and you&#039;ll risk your EYES, so be careful. おかす　冒す /　ぼうけん　冒険 adventure.","If you look at the sun</em> high in the sky directly with your <em>eyes below, you&#039;re taking a big risk.","It is risky to look at the sun with your eyes.","[ risk</strong> = sun</em> / <em>eye</em> ] - it is <strong>risky to stare at the <em>sun</em> with unprotected <em>eyes.","Sun</em> directly into the <em>eye is risky!","looking</em> up at the <em>sun is a risk."
19,"My companion and I are like two moons side by side.","One moon is lonely. Two moons are companions.","Under the twin moons of Tatooine, Luke had no COMPANION.","Companion = flesh of my flesh.","Two bodies next to each other; companions.","Real companions stay together during dark times, under many MOONS, or many MONTHS...","Month to Month my companion is by my side.","MONTH by MONTH, I grow closer to my COMPANION.","Sailor Moon and her cat Luna are companions.","From MONTH to MONTH, my COMPANION is always there."
20,"The sun makes the moon bright.","The sun and the moon are brightest objects in the day and night, respectively.","In the long run, the REAL trouble here is distinguishing it from &quot;shining&quot;/&quot;sparkle&quot;. Choose a story to learn how to write 明. To distinguish it, remember the Japanese word 明日 (ashita, &quot;tomorrow&quot;) and think of Orphan Annie singing &quot;Tomorrow is a brighter day&quot;.","The SUN is BRIGHTER than the MOON.","The two bright</strong>est things in the sky: the sun</em> and the <em>moon</em>. <em>For order, remember that the sun is the<strong> brighter of the two, and should be written first.","About the order of the primitives: The phrase that I usually hear is &quot;the sun and moon,&quot; so to help me remember the order, I&#039;ll remember that phrase. Oh! Better yet, I&#039;ll put them in order of brightness.","Every day of the month is bright.","The SUN and MOON are what keep the sky BRIGHT.","The sun is BRIGHTer than the moon, though the moon appears larger in the sky.","The sun</em> shining <em>right</em> into the <em>moon looks bright."
21,"Someone chanting with their mouth open for two consecutive days.","Chants from our mouths are meant to reach the sun and the stars. Stars are just suns just further away so they seem smaller.","His mouth</em> chants always when <em>prosperous.","The monk opened his month and chanted for two days.","A yogi opens his mouth</em> and chants for <em>two straight days! [So, did you reach nirvana? &quot;Nah, got a wicked sore throat, though.&quot;].","My Zen Buddhist friend used to light a candle, open her mouth</em> and chant for <em>prosperity</em> (<em>day</em> after <em>day).","I opened my mouth wide and chanted for 2 days.","Your <a href="/study/kanji/0.000000E+0050.0000000X0P+03">口</a> (<span class="frnr">#11</span>) will hurt if, day after <a href="/study/kanji/0.000000E+006"Chanting the same prayer day</em> on <em>day　ショウ　唱（とな）える　.","合唱<a href="/study/kanji/0.000000E+00522,"A diamond sparkles as brightly as three suns.","Sparkle is a <a href="/study/kanji/0.000000E+0060X0P+030X0P+0E">森</a> (<span class="frnr">#209</span>) of suns!","Nothing sparkles like 3 suns!","Sparkle, three suns sparkling like zelda pyramids ;-).","Wow - Has been ages since I got this character up in a review, I failed it because I thought of a different kanji. Anyway this Kanji has a lot to do with crystals and crystal structure 液晶liquid crystal, 結晶 crystal, crystallization, crystallisation, 結晶学 crystallography. So the connotation of &#039;diamond&#039; is really good - maintain that and it will easily let you fall back to its main usage of crystals.","Three suns sparkle like Zelda&#039;s Triforce.","The sun sparkled for 3 days...1 液晶　えきしょう (n) liquid crystal 2 結晶　けっしょう (n,vs) crystal; crystallization; crystallisation 3 水晶　すいしょう (n) crystal.","Three suns sparkle brilliantly.","A CRYSTAL</strong> can<strong> SPARKLE as brightly as three suns.","A diamond can sparkle as brightly as three suns."
23,"Three boxes</em> of goods are devoured by the hungry <em>mouths of waiting consumers.","Three hungry mouths waiting for the goods to come.","Boxes of goods stacked on top of the other.","Three stacked crates of mouth-watering GOODS, ready for delivery to the restaurant.","しな。ひん。 A lot of mouths opened desperate for goods.","Three MOUTHs talk about these three boxes of GOODS : the producer’s, the supplier’s and the customer’s.","&quot;Three floating mouths ate all my goods!&quot;","Hin: 食料品 【しょくりょうひん】Groceries Shina: 品物 【しなもの】 goods</strong>, article, thing; Sheena and Hina-chan buy a lot of<strong> goods.","The three burglars stood staring, mouths wide, at the huge pile of loot. Look at all those GOODS!","Give me a HINt why SHINA needs three boxes of goods."
24,"Spine connects head and body.","The spine goes from one opening mouth/opening (mouth/face) to another mouth/opening (genitals). Just think of these openings being enlarged to represent the head and the body. The bottom is bigger because the body is bigger than the face.","The spine goes from one opening mouth/opening (mouth/face) to another mouth/opening (in your ass).","I looks like two vertebrae connected by nerve threads.","In &quot;The Human Centipede&quot;, one spine connects two mouths to keep the food circulating.","Looks like two vertebrae linked together. Continue this pattern, and you&#039;ve got a spine.","The SPINE CONNECTS the Opening</em> at the top to the <em>Opening below.","&quot;Two&quot; much mouth, not enough SPINE. 風呂　ふろ(Japanese bath).","Looks like a head and a body attached by a spinal cord.","The two &quot;openings&quot; in your body (mouth, bottom) are connected by your spine!"
25,"If you work from Sun UP to Sun DOWN you will be prosperous.","I kept getting this mixed up with meanings like &#039;fortune&#039;, so here is a fool proof story! Remember the Vulcan salute from &#039;Star Trek&#039; (a fiction of the sci-fi genre in which heavenly bodies such as SUNS play a huge role) used with the phrase &#039;live long and PROSPER&#039;? If that&#039;s not enough of a visual reminder, the Vulcan salute shows the fingers parted in to 2 sets of 2, and visually kind of looks like this kanji if you think about it.","When you are prosperous, your gold shines as brightly as two suns.","The Egyptians were prosperous because every two days, they worshiped the sun god at the sun pyramid. (Thanks for the idea adhmm, for a while I have had trouble remembering which sun is biggest. Got it now!)","If you work from sun up</em> to <em>sun down you will be prosperous.","Two sunny days make farmers prosperous.","When you become prosperous, your days are twice as sunny.","Two suns are prosperous indeed. The one which is closer to us (i.e. lower) appears larger.","The double suns of Tatooine made George Lucas very PROSPEROUS.","Hopefully the second day</em> will be more prosperous than the <em>first one(second day is bigger)."
26,"The sun</em> up is early, well before <em>ten.","EARLY, is when you have to start your day</em> before <em>10..","An early sun-flower looks like a miniature sun perched on a needlelike stems.","The sun</em> rises early - before <em>ten.","Sun flower blossom early.","If I woke up early, I&#039;d look like this.","Early morning Sunflower.","A sunflower is the EARLY riser in the garden before <a href="/study/kanji/0.000000E+005"Presto</strong>, <strong>veloce</strong> : Pensare al Kanji come alla rappresentazione di un girasole (il fiore del sole) che si alza al mattino presto per seguire il sole nel suo percorso durante tutto il giorno. <strong>Primitive</strong> : Girasole. <strong>Composizione</strong> : <a href="/study/kanji/0.000000E+006"Early sunflower</em> basks in the <em>needles of sunlight."
27,"9am carries with it the rising sun.","Nine planets revolve around our rising sun.","The sun rises before 9am.","When the clock says 9</em> on the left, you can see the rising <em>sun in the east (right).","A baseball player hits the sun and it becomes the rising sun.","To me, the left-hand element (nine) resembles the side view of the front of a forklift truck. The second stroke forms the forks. Thus the sun</strong> is <strong>rising on the forks.","At 9</em> am the <em>sun rises.","Nine days, nine baseball players, in the land of the rising sun, where baseball reigns supreme!","In order to have a rising sun, it takes a total of nine gods to give it a swift kick in the butt.","If 10am is considered early (早) then I guess 9am is when the sun is just rising."
28,"3 tens = generation.","They SAY</strong> a<strong> generation</strong> is ten</em>+<em>ten</em>+<em>ten</em> years, with the big first <em>ten</em> providing a <em>grounding</em>, and the next <em>ten</em> providing a little more <em>grounding</em> for the final <em>ten. But I wish the next<strong> generation</strong> didn&#039;t always <strong>SAY</strong> &quot;<strong>yo!&quot;. (ON reading is SEI, KUN reading is yo).","That swing has been in that tree for generations.","This looks like a picture of a test tube in a holder. Maybe it will be used to create test tube babies for a future generation.","The next generation is carried by the previous ones.","Mother with 2 kids sitting in her lap.","よ</strong>---In the present<strong> GENERATION, babies may be produced from TEST TUBES. remember the stand holder at the bottom!!","Test tube GENERATION.","Ten years is a decade; 3 decades is a generation.","Three tens EQUAL (hence the two horizontal lines on the bottom, think equals sign) thirty: a generation."
